63072735,木子,女,31,宝鸡,165,大专,"23-40岁,155-189cm,陕西,宝鸡",未婚,,　　执子之手，与子偕老。...,https://at2.jyimg.com/5e/dd/fe44da5401c53b4455f4d134651f/fe44da540_5_avatar_p.jpg
37089695,且尽.,女,29,杭州,160,本科,"28-43岁,170-185cm,本科,有照片,浙江,杭州",未婚,,我是一个直率，开朗的女孩子。业余时间喜欢旅行、看书、练瑜伽、摄影。我在事业单位从事平面设计工作。                                          …,https://at2.jyimg.com/9e/09/b3ce6585c1fc6394839ca09e3b7c/b3ce6585c_16_avatar_p.jpg
74588186,苏童谣,女,28,哈尔滨,168,大专,"28-38岁,175-200cm,高中中专及以下,有照片,未婚、离异,黑龙江,哈尔滨",离异,,如果来信发现正在征友中发不了，就过几天在发，因为家里人给开了排名靠前，导致天南海北的系统信每天能来几千条，实在受不了，就暂时改了状态，还有5天就熬过去了～希望来信可以认真看好以下内…,https://at1.jyimg.com/0f/1a/335791604c87d18a7d22de9b9a21/335791604_13_avatar_p.jpg
107587486,淼淼,女,30,乌鲁木齐,165,本科,"27-35岁,175-190cm,大专,有照片,未婚,新疆,乌鲁木齐",未婚,,我没有邮票哦，只能看免费信件~        平时圈子较小，没有遇到自己合适的另一半，但是看着身边的朋友都结婚了，觉得我也该认真找找我的另一半。        如果看到我的资料觉得…,https://at1.jyimg.com/c8/36/13ac9b242dff40d3f1d198890631/13ac9b242_7_avatar_p.jpg
121895960,娅娅,女,31,济南,165,大专,"24-31岁,173-185cm,大专,有照片,未婚,山东,济南",未婚,,天秤座女生一枚。性格安静居多，有点宅。平时喜欢看电影、看书，听音乐，逛街，健身。身边的很多好友拥有了幸福，有种孤单的感觉。在这里希望自己能够遇见牵手一生的他。  喜欢舒婷的诗句，“…,https://at1.jyimg.com/09/15/2c722d20c1704d6172357b2dbf51/2c722d20c_9_avatar_p.jpg
28926288,寻找幸福,女,31,枣庄,162,高中中专及以下,"22-29岁,168-185cm,有照片,未婚、离异,山东",未婚,,　　注册这么久，还没有遇到自己那个对的人，不知道该不该继续相信这个东西，自己是个普通的女孩子。没有什么特别的好的条件，只是想找个适合自己的那个人，一起变老，难吗？等待中，信件看不到…,https://at3.jyimg.com/2f/7e/6e0ae7bdc0dd803692407d849f4c/6e0ae7bdc_avatar_p.jpg
140387303,向往,女,31,西城,155,硕士,"28-35岁,173-180cm,本科以上,有照片,北京",离异,,",我的性格活泼开朗，心地善良，处事大方。我现在在自己的企业做企业管理工作，我读的是工商管理专业。我平时的业余时间喜欢音乐，唱歌，健身，我工作认真，孝敬父母，我想时机成熟就结婚，我喜…",https://at2.jyimg.com/57/c0/8b5480bf4f9510ee392d7636c87e/8b5480bf4_7_avatar_p.jpg
42980849,淡然微笑,女,27,杭州,160,大专,"26-32岁,170-189cm,本科,有照片,未婚,浙江",未婚,,我想找一个有眼缘对我好三观正有责任心  认识我就注销佳缘账号的人  非诚勿扰，真心结婚的来，没时间陪人玩，请玩玩的自觉绕道去祸害别人…还有有孩子的也勿扰  卖护肤化妆品，做微商的勿…,https://at3.jyimg.com/ac/5b/a097b2cf68cf7401565d56fdb237/a097b2cf6_5_avatar_p.jpg
61756424,风依飘渺,女,27,杨浦,170,大专,"26-34岁,175-185cm,本科以上,有照片,未婚,上海",未婚,,首先，感谢您阅读我的资料，我是92年的，身高170，因为妈妈是知青的原因，户籍是江苏宜兴的（现在是无锡啦）    但从小在上海长大，幼儿园起都是在上海读的且家人都在上海，如果很介意…,https://at2.jyimg.com/58/da/ed1a87b87720808c43e071646c56/ed1a87b87_4_avatar_p.jpg
79873357,等你爱我,女,31,浦东新区,163,大专,"28-40岁,170-185cm,有照片,未婚、离异,上海",未婚,,我喜欢 上网  看书  旅游。我在业余时间最大的消遣是 唱歌 睡觉。我憧憬的生活是  平淡的生活。我希望我未来的另一半最好是  外向 诚恳  老实 生活有点小情趣，会制造浪漫。希望…,https://at4.jyimg.com/74/b6/4ae00f31cbb2b2ee9da7272a0991/4ae00f31c_1_avatar_p.jpg
95348916,chris克丽丝,女,31,杨浦,161,本科,"28-40岁,170-191cm,本科,有照片,上海",未婚,,    前段时间看到一句话：爱对了的是爱情、爱错了的是青春。不管过去的经历是对是错都还是保持着一颗乐观的心、希望能够遇见对的人。        有自己的事业，近几年的重心也放在事业…,https://at2.jyimg.com/92/06/e0a166e273130c0093352042460e/e0a166e27_4_avatar_p.jpg
47820541,Bling,女,30,深圳,162,大专,"30-38岁,174-190cm,大专,有照片,未婚,广东,深圳",未婚,,找一个简单又适合的人，能一开始就不结束的，玩的感情总是伤不起。 身高172cm以上。性格大方，稳重，上进好学，专一。希望对方不吸烟，可以偶尔小酒一下。。......,https://at4.jyimg.com/b5/21/c8593336d99064cb42fef6f63f13/c8593336d_1_avatar_p.jpg
77829816,滴滴声,女,30,深圳,163,大专,"26-35岁,172-185cm,大专,广东,深圳",未婚,,"HI,首先谢谢看我的资料！大家好!!        我来自湖南常德桃源县一个美丽的小山村，山清水秀，不错，我们家就是陶渊明笔下的那个世外桃源。有空可以去旅游下咯！      现在在…",https://at2.jyimg.com/55/9a/5b9104e4df7e0b34f4c38ab9b7b2/5b9104e4d_5_avatar_p.jpg
92519977,陌路里_,女,31,贵阳,160,本科,"28-39岁,168-185cm,未婚,贵州,贵阳",未婚,,总有一天，你不需要轰轰烈烈的爱情，你想要的只是一个在平淡中守护你的人。冷的时候他会给你一件外套，胃难受的时候他会给你一杯热水，难过的时候他会给你一个拥抱，就这么一直陪在你身边，陪你…,https://at1.jyimg.com/8d/c9/b1d09001e1ae0e92a93b38a95294/b1d09001e_5_avatar_p.jpg
53721659,瑾萱郡主,女,31,长沙,163,本科,"31-39岁,172-190cm,本科以上,有照片,湖南,长沙",离异,,我性格开朗，善解人意，知书达礼，端庄贤惠。教育世家出身，家教严，无不良嗜好，标准乖乖女型。家庭条件良好。一本毕业，在央企上班，工作稳定，福利待遇尚可。已定居长沙，有个代步车。理…,https://at2.jyimg.com/19/b7/1d12f526ddddeb26bcaq6fc98c0b/1d12f526d_12_avatar_p.jpg
39435971,佳雯,女,30,宝山,170,本科,"28-35岁,180-188cm,本科,有照片,未婚",未婚,,开心的时候什么都觉得很好玩 不开心的时候什么都不爱玩只想睡觉。平时无聊的时候，我经常逛街 看片。我憧憬的生活是两个人背靠背坐在沙发上看着杂志晒着太阳，聊天品味生活，嘴角洋溢着幸福的…,https://at3.jyimg.com/ed/34/23bfb0f7a79ea02e97e66f0d42a9/23bfb0f7a_6_avatar_p.jpg
18030882,Guccｉ,女,30,达州,160,本科,"28-40岁,168-188cm,大专,未婚、离异,四川",未婚,,非诚勿扰...,https://at1.jyimg.com/89/3d/5089b3e1f54dd2c6e79fcde7063e/5089b3e1f_20_avatar_p.jpg
92927511,唯一,女,30,南昌,160,大专,"26-35岁,165-200cm,未婚",未婚,,有缘来到世纪佳缘，请认真对待。以结婚为目的，不是请绕过。...,https://at2.jyimg.com/93/b2/76d02aae6388067d9255366e56ca/76d02aae6_1_avatar_p.jpg
166292564,白咖啡,女,31,西安,165,本科,"28-37岁,172-不限 cm,本科以上,有照片,未婚、离异,陕西,西安",离异,,我是一个诚信的人 ，爱好广泛的我，喜欢健身，关于外貌，简单形容就是小酒窝。,https://at1.jyimg.com/09/2a/ebc3d4bd0d0caq51060677018e00/ebc3d4bd0_1_avatar_p.jpg
25567202,liandiecao,女,31,厦门,165,大专,"23-30岁,170-190cm,大专以上,有照片,未婚,福建,厦门",未婚,,　　希望借助这个平台能够找到未来的另一半 目前在厦门；没有邮票的就不用给我发邮件了，发了我也看不见，谢谢！...,https://at4.jyimg.com/bf/85/7d545150f16198a185d2fae10525/7d545150f_12_avatar_p.jpg
41156373,CC,女,30,东莞,157,大专,"29-36岁,171-180cm,高中中专及以下,未婚,广东,东莞",未婚,,人生中最幸运的事就是对的时间遇到对的人，爱如最初，久处不厌都需要用心。ps:年龄填写错误 本人是92年的天蝎座...,https://at4.jyimg.com/f7/43/c67627587e50af5fa3a98fafd1ed/c67627587_16_avatar_p.jpg
39117429,我,女,30,南宁,160,本科,"28-32岁,170-185cm,本科,未婚,广西,南宁",未婚,,你最爱的，往往没有选择你；最爱你的，往往不是你最爱的；而最长久的，偏偏不是你最爱也不是最爱你的，只是在最适合的时间出现的那个人  女人，......,https://at3.jyimg.com/60/00/fdb4f95e66e507cc46d208ce1281/fdb4f95e6_23_avatar_p.jpg
31300820,小巧玲,女,31,娄底,163,高中中专及以下,"35-45岁,168-180cm,有照片,未婚、离异,湖南,娄底",未婚,,"我喜欢逛街。我在业余时间最大的消遣是健练。我憧憬的生活是有一个冲満活力的家。我希望我未来的另一半最好是包容,体贴,有孝心  。真心希望在这里能遇到我的那个TA!......",https://at2.jyimg.com/13/ab/73e4e16bbf7ed8f8451e53a3aq9e/73e4e16bb_7_avatar_p.jpg
78918003,壹抹淡笑,女,31,昆明,162,高中中专及以下,"32-37岁,174-180cm,有照片,云南,昆明",离异,,爱情没有条条框框，幸福就是理想国度    　　我不知道自己是个怎样的性格            我不会骂人        不会发火(如果我很不高兴了会不说话        你只要稍…,https://at3.jyimg.com/23/62/c173a23808a2968138d7ea142d4d/c173a2380_avatar_p.jpg
164903907,梦缘,女,28,韶关,161,高中中专及以下,"39-56岁,158-185cm,高中中专及以下,有照片,广东",离异,,我是个受伤的女人，不懂的暧昧。往事在我身上发生很多事，我就不在佳缘一一说，目前我带个几个月孩子身边，暂时没工作。    在佳缘只想寻求一位能懂我，能理解我，互相互持。没有大男子主义…,https://at2.jyimg.com/d2/81/ee133598fd82541a0076f2b47dfb/ee133598f_1_avatar_p.jpg
112213434,兔子,女,30,太原,168,大专,"24-37岁,180-190cm,有照片,未婚、离异,山西,太原",未婚,,发信的时候请各位先看看所在地，我不接受异地恋。另外，我比较介意身高，我净高168，要求180以上！虽然这里紧紧是网络，还是希望能够认识诚实的人，否则请不要浪费大家的时间！要相信…,https://at4.jyimg.com/79/f3/500fe32f01f80ab62861a25d053f/500fe32f0_18_avatar_p.jpg
31671200,朶朶美,女,31,海淀,163,本科,"24-不限 岁,177-不限 cm,有照片,未婚,北京",未婚,,给我一个100%纯爷们&#039;不含任何防腐剂&#039;   请问有专一责任男吗？不劈腿的&#039;我要双份&#039;    来一份男人&#039;多一点实在&#039;少耍点帅&#039;嗯嗯&#039;就这样吧    我呢？据朋友说长得还行（真的还行&#0,https://at2.jyimg.com/9b/e2/1e3642023e2d93ebaf9e2360132e/1e3642023_3_avatar_p.jpg
113375393,晴天娃娃,女,30,南京,160,大专,"26-32岁,175-186cm,本科以上,未婚,江苏,南京",未婚,,一天很短，短得来不及拥抱清晨，就已经手握黄昏！ 一年很短，短得来不及细品初春到殷红窦绿，就要打点素裹秋霜！ 一生很短，短的来不及享用美好年华，就已经身处迟暮! 总是经过的太快，领悟…,https://at3.jyimg.com/6e/33/b483941829e9f0466305b1d82103/b48394182_21_avatar_p.jpg
28661025,小麻雀,女,30,郑州,162,大专,"27-40岁,175-183cm,有照片,未婚",未婚,,一个人时间长了，还是挺累的，想找了肩膀依靠。突然觉得自己很悲哀，生病了身边连个说话的人都没有，如果你是我的那个他，与我联系吧，期待你的来信，没有邮票看不了，很抱歉哦，不要错过机会。…,https://at4.jyimg.com/70/ee/d6ce44903a50d1171dc58af7b2ed/d6ce44903_5_avatar_p.jpg
50928219,青青河边草,女,28,徐州,160,大专,"28-33岁,170-176cm,大专,有照片,未婚,江苏,徐州",未婚,,不需要你多有钱，也不需要你有多帅，希望你是个踏实过日子的暖男，徐州本地的，外地的不考虑了，系统消息不用发了，不会回，谢谢！...,https://at2.jyimg.com/56/ec/6f227296bf821dc7cf1251a6cebb/6f227296b_178_avatar_p.jpg
98052742,李佩佩,女,30,沧州,163,大专,"23-40岁,158-190cm,河北,沧州",未婚,,　　爱瞎想，易感动，笑点泪点都很低，朋友不多，但始终坚信，物以稀为贵，爱情亦是如此。&amp;lt;br /&amp;gt;&amp;lt;br /&amp;gt;　...,https://at4.jyimg.com/72/58/676bc69c033f0418df32ec5b6756/676bc69c0_20_avatar_p.jpg
13032505,寻找我的小屋,女,29,怀化,164,大专,"30-40岁,168-178cm,大专以上,有照片,未婚,湖南",未婚,,由于工作关系，我只能在怀化，鹤城，找对象，其他地方的都不要来信。    离开怀化就没有工作了，养得起的可以来信。    佳缘里你的资料要真实的。假的，考验式的，请不要来信。我经常下…,https://at3.jyimg.com/aa/f4/19d9a71279dc53bfe556b010f77b/19d9a7127_2_avatar_p.jpg
72855573,vi慧,女,27,中山,155,大专,"20-33岁,172-183cm,大专,有照片,未婚,广东,中山",未婚,,我是本地人，喜欢很疼我的人，脾气好的，经济好的，时尚点的，诚意贴票！！非诚勿扰！！不好意思这偶尔上下持续单身中...,https://at1.jyimg.com/88/33/d6a05bba8d0bf6d9b8cbffd5513a/d6a05bba8_3_avatar_p.jpg
94231525,小幸福,女,31,济南,155,大专,"27-35岁,173-180cm,有照片,未婚,山东,济南",未婚,,真诚 简单，希望你是一个脾气好、愿意被我欺负的人，嘿嘿        希望遇见的每一件事都能与你分享，希望你就是那个可以陪我一起疯一起笑的人...,https://at3.jyimg.com/22/dc/3e34592e25f6d6b00aa9b03aa5a5/3e34592e2_16_avatar_p.jpg
46205855,学无止境,女,31,武汉,163,本科,"29-37岁,170-187cm,本科以上,有照片,未婚,湖北,武汉",未婚,,普通本科毕业，但是自己比较努力，现在在一所重点小学做老师。如果对学历有比较高的要求的男生，请绕道。    性格活泼，但是工作原因，交友圈子一直很窄，在感情中有点慢热，前期可能需要男…,https://at1.jyimg.com/c6/f8/aq2bff709350bda0d9f8178ee050/ad2bff709_10_avatar_p.jpg
73003441,贝贝,女,29,深圳,162,本科,"29-35岁,172-185cm,本科,有照片,未婚,广东,深圳",未婚,,来这里是来碰碰运气的，知道很难，但还是想尝试，以前自己太被动，总是 希望等待那一位的出现，但限于圈子原因可能等待也许很困难，被朋友上课，觉得也需要主动去寻找，所以我认真的来到这里 …,https://at2.jyimg.com/56/5c/4e46e449df664210b28f8fff00b8/4e46e449d_2_avatar_p.jpg
103902868,sarah,女,30,青岛,168,本科,"30-38岁,175-183cm,本科,有照片,未婚,山东,青岛",未婚,,找一个会在钱包里放我照片的男人，敢让我知道微信密码的男人，敢在微博博客写我的男人，敢让我知道他一切的男人，就算在我任性说分手的时候也不会抛下我，会紧紧拥抱我不让我走的男人，敢对我一…,https://at4.jyimg.com/f4/47/e03af23f3339b9cbda8af7af3616/e03af23f3_8_avatar_p.jpg
112293190,Summer,女,29,长沙,162,本科,"26-33岁,175-186cm,有照片,未婚,湖南,长沙",未婚,,很多时候总是忘记登陆世纪佳缘。所以会错过好些来信。  但一旦登录我都会认真看来信。  我想，感情里缘分是不可或缺的存在。  我期待能在这里遇见对的你。  重声：异地勿扰，非诚......,https://at4.jyimg.com/fe/0f/d3ccb21b67c60d598953be592fd4/d3ccb21b6_15_avatar_p.jpg
121530539,cathy,女,30,深圳,165,本科,"26-35岁,173-188cm,本科,有照片,未婚,广东,深圳",未婚,,我是一个美腻可爱的胖纸，如果喜欢骨感的可以不用考虑咯～一直都有尝试减肥，不过都会忍受不住美食的诱惑，性格比较乖，比较低调，外冷内热。喜欢音乐，看电影，五颜六色的东西，摄影，旅游，还…,https://at2.jyimg.com/19/4b/3b69ce4124e197b8723ac490c4bd/3b69ce412_9_avatar_p.jpg
102889535,半夏微凉,女,30,广州,163,本科,"27-35岁,173-185cm,本科,有照片,未婚,广东,广州",未婚,,谁执我之手，消我半世孤独；谁扶我之肩，驱我一世沉寂。我是一个外向，乐观，积极向上的女孩儿，样子也还算不错，爱笑，爱旅游，爱音乐，爱交朋友。小康家庭，父母仁慈，和蔼，虽然我是独生女，…,https://at4.jyimg.com/f1/86/a97b71e4ca915e758f43987725e5/a97b71e4c_3_avatar_p.jpg
44606871,苗苗,女,30,邵阳,167,大专,"27-36岁,170-186cm,有照片,未婚",未婚,,有乐观的心态和足够的真诚。 如果你愿意宠我，包容我，就用真诚的心来对待我·同样我也会很真诚的对你· 我要找的是能给我安全感的港湾所以我的那一位一定要有责任心”有事业心”爱心…,https://at2.jyimg.com/1a/f6/f1b646a1cc190c50f9e6c79b6d1d/f1b646a1c_8_avatar_p.jpg
55565509,Eva,女,28,常州,163,大专,"30-36岁,175-180cm,本科,有照片,江苏,常州",离异,,请自觉简短的介绍下您的各方面情况，方便快速了解，通过沟通和了解后才加私号，这也是一种尊重！沟通上请真诚相待，非诚勿扰，谢谢！...,https://at3.jyimg.com/68/0a/9b8f2a5923f1161187be4f38c4ba/9b8f2a592_22_avatar_p.jpg
80379185,晴竹,女,27,嘉定,168,本科,"33-38岁,173-185cm,本科,有照片,未婚,上海",未婚,,211金融学本科毕业的我是一个喜欢在工作中不断做“攀登者”，取得职业上的价值感；一个喜欢在生活中探索文艺情怀——书法、旅行、演讲、瑜伽、音乐、调香，制造生命里的新鲜感。Coco …,https://at2.jyimg.com/13/e7/fef6f0e02a25971b6eb30743bf4a/fef6f0e02_8_avatar_p.jpg
105297574,兔粢,女,26,长沙,160,大专,"22-28岁,173-185cm,大专以上,有照片,未婚,湖南,长沙",未婚,,&amp;nbsp;&amp;nbsp;&amp;nbsp;&amp;nbsp;&amp;nbsp;&amp;nbsp;&amp;nbsp;&amp;nbsp;&amp;nbsp;如果你走进了我的世界，那么请不要轻易放弃。真心希望在这里能遇到我的那个TA!目前人在深圳，一月份回湖南。......,https://at4.jyimg.com/7c/0a/6fbb84cf9b26b77fae69c2393a6b/6fbb84cf9_3_avatar_p.jpg
47667753,且听风吟,女,31,武汉,160,硕士,"29-42岁,175-180cm,本科,未婚,湖北",未婚,,心思简单，爱笑，内心传统善良，与人交往以感恩豁达的态度面对。平时喜欢画画，健身，偏向爱好色彩意境一类的事物。内心的那个他，希望是善良有修养，成熟智慧，热爱生活，有正确的家庭观念的人…,https://at1.jyimg.com/88/d9/fe253db0dcba119ec6a948889d1a/fe253db0d_7_avatar_p.jpg
31723153,芒果慕斯,女,28,海淀,160,大专,"27-35岁,175-186cm,有照片,未婚、离异,北京",离异,,错的人迟早会走散，对的人早晚会相逢。我们没有未卜先知的能力，算不出最美的相遇在什么时候，最痛的离别在哪一天，我们能做的就是珍惜眼前的。......,https://at3.jyimg.com/a4/d0/39bb77e0b962b0faf871d0ef7f2f/39bb77e0b_avatar_p.jpg
151297170,美丽的心,女,28,东城,173,本科,"28-45岁,175-190cm,博士以上,有照片,江苏",未婚,,各位男士来信请注明结婚硬件，比如房子车子情况，工作状况，年收入情况，择优录取，条件不好的男士请不要来信了哈！...,https://at1.jyimg.com/46/d7/bf6d0dab00896e2caca888ec8f6e/bf6d0dab0_52_avatar_p.jpg
68284051,恣秋,女,29,成都,165,本科,"29-38岁,172-185cm,大专,有照片,未婚,四川,成都",未婚,,首先说个对不起，有小孩的不考虑，实在是没有这样的心理准备。 我不是白富美 高富帅我hold不住  普普通通，踏踏实实就好 如果你想玩玩儿，求你高抬贵手，别浪费大家时间 如果你只是想…,https://at4.jyimg.com/f3/30/243db73b7f299dc75844f82e3a61/243db73b7_3_avatar_p.jpg
111567854,等待,女,31,济南,166,大专,"28-36岁,175-191cm,有照片,未婚,山东",未婚,,我憧憬的生活是简单中偶尔小资浪漫。我希望我未来的另一半最好是成熟稳重有气质有责任心不失小幽默。真心希望在这里能遇到和我一样有结婚计划的他。接受闪婚!不真诚的请绕过！不要浪费彼此宝贵…,https://at3.jyimg.com/e4/9e/e2ef0eec3f5dea3a7791df3b49e7/e2ef0eec3_18_avatar_p.jpg
32880929,Sagapo 。,女,27,西安,156,本科,"27-37岁,172-180cm,有照片,未婚",未婚,,长得丑的就不要发了   有些东西失去了永远不会再回来。  没回信就是对你没兴趣， 不来电  ...,https://at3.jyimg.com/24/dc/0f08bece0b6678ebaaq7306a9baq/0f08bece0_16_avatar_p.jpg
68367505,alice,女,30,日本,167,硕士,"27-32岁,175-185cm,本科以上,有照片,未婚,上海",未婚,,我喜欢唱歌 跳舞 文艺 游泳。我在业余时间最大的消遣是和姐妹们在一起 逛街。我憧憬的生活是不知道自己要过怎样的生活 但是知道不要过怎样的生活。我希望我未来的另一半最好是 开朗 幽默…,https://at3.jyimg.com/aq/3c/dded12fda171599fc72155ff1774/dded12fda_2_avatar_p.jpg
61851872,"坏的好人,",女,28,沙坪坝,160,本科,"28-35岁,173-177cm,本科,有照片,未婚,重庆",未婚,,不知不觉年龄不小了，身边的朋友都结婚生子了，确实心里有点着急了，不过也宁缺毋滥不想将就，平时生活圈太小接触不到什么异性，所以希望通过这个平台找到真爱，遇到合适的接受一年以内结婚。（…,https://at1.jyimg.com/0e/40/2fe2efd5dc6d468ebf9b9502673b/2fe2efd5d_18_avatar_p.jpg
92519906,赵永丽,女,29,成都,165,本科,"26-38岁,170-190cm,大专,有照片,未婚,四川,成都",未婚,,目前居住地：人在成都，资料真实家中：父母退休.有退休金.有国家保险.有商业保险.幸福美满家庭长大.父母非常恩爱.如果觉得外面花花世界还没有看够，勿扰，喜欢低俗趣味勿扰，用钱买卖…,https://at2.jyimg.com/17/41/2cb72aqa543c2a4e5881dbcdf697/2cb72ada5_17_avatar_p.jpg
96008341,涵涵,女,30,宝鸡,163,本科,"26-30岁,170-180cm,本科,有照片,未婚,陕西,宝鸡",未婚,,幸福可以来的迟一点，只要它是真的。愿有岁月可回首，且以深情到白头……...,https://at3.jyimg.com/64/fa/302a53263dd0b9cb546d5bea929b/302a53263_15_avatar_p.jpg
26009945,小洁,女,31,南京,175,硕士,"27-38岁,175-190cm,本科,有照片,未婚、离异,江苏,南京",离异,,很认真来这里，本人从事教育行业，我喜欢成熟稳重男士，希望在这里开花结果；...,https://at3.jyimg.com/66/f2/07d7be441c5c1dcd6be70d2047dc/07d7be441_11_avatar_p.jpg
99624166,wm666,女,29,长沙,162,本科,"25-35岁,170-186cm,本科,未婚,湖南,长沙",未婚,,本人性格温和，相信缘分，家庭观念比较重，希望找到那个对的人，我喜欢看书人物传记，喜欢看纪录片经典传奇，穿越经典，档案，老梁观世界等，我最爱老梁，希望你跟我一样喜欢看纪录片，我是典型…,https://at4.jyimg.com/7d/33/74f59e7d09d495119ebfeb66daef/74f59e7d0_9_avatar_p.jpg
106876252,向日葵.,女,26,宜昌,160,本科,"24-33岁,170-185cm,本科,未婚,湖北,宜昌",未婚,,找个对我好的，真诚的，不需要你多么优秀，但必须要有正当工作。本人是真心来找未来的对象，玩玩而已，二婚大叔有小孩，骗子，勿扰！本人没有时间陪你们玩！非诚勿扰！！我好像不是什么会…,https://at4.jyimg.com/76/fc/7482297d8952e227b21224121f72/7482297d8_10_avatar_p.jpg
136907215,清风自来,女,28,深圳,158,大专,"26-36岁,170-182cm,本科,有照片,未婚,广东,深圳",未婚,,喜欢成熟稳重、用情专一、阳光简单点的男生，真诚找结婚对象，非诚勿扰！...,https://at3.jyimg.com/a7/d7/a937f90300aa5505a26c4e606886/a937f9030_10_avatar_p.jpg
56440750,寿show,女,27,朝阳,165,硕士,"27-37岁,175-185cm,硕士,有照片,未婚,北京",未婚,,城市的一方烟火，容纳着温暖的阳台，昼夜的情话和蠢萌的猫狗。最好的爱情，不过是遇见一个人，先相见恨晚，后余生与共。 ​​​...,https://at1.jyimg.com/c3/8a/0ccb609dd5a4a0b94b99b11d91b0/0ccb609dd_12_avatar_p.jpg
68207324,小尼姑味,女,30,郑州,168,本科,"25-33岁,175-188cm,大专,有照片,未婚,河南,郑州",未婚,,　　我想有个家&#039;...,https://at4.jyimg.com/3d/bb/9611e334fbaa4ec238e187639119/9611e334f_avatar_p.jpg
147219707,*-*樱桃子 ~,女,29,西安,163,本科,"25-33岁,173-188cm,本科,未婚,陕西,西安",未婚,,如果一件东西，踮起脚就能够着了，你就去够；如果站在那里不断的使劲跳起来也还是够不着，那就别够了，没必要把自己搞的那么累。爱情，亦是如此吧。凡事要看开一些，看透一些，什么都在失去，什…,https://at2.jyimg.com/d5/a3/eae1e2e841a67ef278473a657bf5/eae1e2e84_5_avatar_p.jpg
109944576,小仙儿,女,31,杨浦,167,本科,"29-35岁,178-190cm,本科,有照片,未婚,上海",未婚,,310110上海人，本科毕业，之后一直在大型国企工作，和父母同住，生活圈子简单，不算特别宅，在家里喜欢追追剧，做做瑜伽，整理整理家务，也喜欢和朋友出去聊聊天，拔拔草，每年至少两次旅…,https://at4.jyimg.com/f1/16/61872446f4c93089bc56051443ee/61872446f_80_avatar_p.jpg
157561236,Amanda,女,31,英国,168,硕士,"25-35岁,178-188cm,本科以上,有照片,未婚,其他国家,英国",未婚,,欢迎来到我的主页！在这里等待的是一个相互尊重的终身伴侣，共同打造和经营温馨和睦的家庭。执子之手，与子偕老。 关于我：皮肤白皙细腻，高挑修长比例好，气质温婉知性，有涵养，真人比照片好…,https://at1.jyimg.com/0b/2b/96487bf6343d1820cfee86e00db4/96487bf63_3_avatar_p.jpg
